{
  "basics": {
    "name": "David C Reay",
    "label": "Senior AWS Architect & DevSecOps Engineer",
    "image": "https://avatars.githubusercontent.com/u/15360496",
    "email": "david@awsbot.com",
    "phone": "+44 (0) 7834 980 889",
    "url": "https://forhire.awsbot.com",
    "summary": "Strategic AWS Solutions Architect (Professional) and MBA Technology Management Graduate with 15+ years of experience in high-security infrastructure and automated systems engineering. Expert in bridging the gap between engineering and compliance (ISO27001/SOC2), with a proven track record of reducing operational costs by up to 80% through serverless refactoring and automated vulnerability remediation. Post-nominals: MBA, BSc. Security Clearance: BPSS (Active).",
    "location": {
      "city": "London",
      "countryCode": "GB",
      "region": "United Kingdom"
    },
    "profiles": [
      {
        "network": "LinkedIn",
        "username": "davidreay",
        "url": "https://www.linkedin.com/in/davidreay/"
      },
      {
        "network": "GitHub",
        "username": "davidcreay",
        "url": "https://github.com/davidcreay"
      }
    ]
  },
  "work": [
    {
      "name": "Tabled Technologies Limited",
      "position": "Senior DevOps Engineer",
      "startDate": "2025-12-01",
      "endDate": "2026-02-01",
      "summary": "Spearheaded the infrastructure remediation and security hardening required for ISO27001 Stage 1 and Stage 2 compliance. Collaborated with external auditors (Cognisys) to identify gaps and implemented automated monitoring, logging, and network isolation across production and staging AWS environments.",
      "highlights": [
        "Successfully prepared infrastructure for ISO27001 Stage 2 audit by remediating Internal Audit gaps A.8.31 and A.8.32.",
        "Reduced Secrets Manager costs by approximately 83% by architecting JSON-bundled secret storage.",
        "Fully automated security agent deployment (Trend Micro) via GitLab CI/CD and AWS Systems Manager.",
        "Achieved 100% visibility for critical database and load balancer metrics through Infrastructure-as-Code monitoring.",
        "Infrastructure Modernization: Migrated legacy NGINX EC2 reverse proxies to AWS ALBs with automated SSL.",
        "Network Security: Executed full VPC network segregation, migrating Elastic Beanstalk applications to private subnets.",
        "Security Hardening: Implemented AWS GuardDuty, automated SSH lockdown scripts, and enforced CloudTrail log integrity.",
        "Serverless Migration: Refactored tasks into serverless AWS Lambda functions with EventBridge triggers."
      ]
    },
    {
      "name": "Giacom (Communications) Limited",
      "position": "Senior Data Engineer",
      "startDate": "2024-04-01",
      "endDate": "2025-02-01",
      "summary": "Responsible for designing and implementing data architecture solutions, building and maintaining data pipelines for a team delivering AWS-based data solutions.",
      "highlights": [
        "Architected multi-account AWS Landing Zones and VPC segmentation using Terraform.",
        "Developed automated CI/CD pipelines for data solutions using Glue and Lambda.",
        "Mentored junior staff on DevSecOps best practices and AWS Well-Architected Framework.",
        "Utilized Amazon Bedrock and Generative AI (Chat-GPT)."
      ]
    },
    {
      "name": "Mental Health Innovations UK",
      "position": "Data Engineer",
      "startDate": "2023-05-01",
      "endDate": "2024-01-01",
      "summary": "Contract to develop an existing de-identification data pipeline with pyspark and NLP.",
      "highlights": [
        "Developed an existing de-identification data pipeline with Pyspark and NLP.",
        "Performance testing and enhancement with ARM64 AWS Graviton processors.",
        "Implemented TDD with pytest, pylint, and OpenAI API.",
        "Infrastructure as Code with CloudFormation and Dockerization with EMR Serverless."
      ]
    },
    {
      "name": "Floyt Mobility",
      "position": "Senior DevOps Engineer",
      "startDate": "2023-01-01",
      "endDate": "2023-06-01",
      "summary": "Contract to migrate a rental car aggregation website into AWS.",
      "highlights": [
        "Migrated rental car aggregation website into AWS using EC2, RDS, and ElastiCache.",
        "Deployed Single Page Application (SPA) using CloudFront, Lambda@Edge, and S3.",
        "Infrastructure as Code with Terraform.",
        "PHP application configuration and deployment with GitLab, CodePipeline, and Docker."
      ]
    },
    {
      "name": "AstraZeneca",
      "position": "Senior DevOps Engineer",
      "startDate": "2022-08-01",
      "endDate": "2022-12-01",
      "summary": "Contract to deploy a Django application in the Beijing AWS region for DNA sequencing pipelines.",
      "highlights": [
        "Deployed Django applications in the Beijing AWS region for DNA sequencing pipelines.",
        "Automated 24+ specialized bioinformatics tools (BLAST, SAMTools) via Ansible.",
        "Developed custom AWS Data Lake using Postgres (RDS), Lambda, and Step Functions.",
        "Jenkins pipeline development and IaC with CloudFormation."
      ]
    },
    {
      "name": "Admiral Pioneer (Veygo / NalahLife)",
      "position": "Senior Developer",
      "startDate": "2022-06-01",
      "endDate": "2022-10-01",
      "summary": "Contract working on AWS serverless infrastructure for a temporary car insurance company (Veygo), and an intrapreneurial health insurance startup (NalahLife).",
      "highlights": [
        "Built AWS serverless infrastructure using Chalice, SAM, and API Gateway.",
        "Integrated AppFlow and Salesforce for business process automation.",
        "Python web development with Django and API development.",
        "Data engineering with Glue, Athena, and Pandas (Parquet)."
      ]
    },
    {
      "name": "Nationale-Nederlanden Investment Partners",
      "position": "Senior Data Engineer",
      "startDate": "2021-04-01",
      "endDate": "2022-03-01",
      "summary": "Contract to work on a team producing back office tools for assessing and reporting on financial risk.",
      "highlights": [
        "Built back-office tools for assessing and reporting financial risk in asset management.",
        "Developed ETL workflows using AWS Glue and Athena for risk measurement.",
        "Serverless development (Lambda, Step Functions, DynamoDB, Cognito).",
        "Python programming with Boto3, NumPy, and Pandas."
      ]
    },
    {
      "name": "Chetwood Financial Ltd",
      "position": "Senior Python Developer",
      "startDate": "2020-09-01",
      "endDate": "2021-03-01",
      "summary": "Contract to build a credit card application system with serverless technologies in AWS.",
      "highlights": [
        "Architected a complex serverless journey management system for credit card applications.",
        "Integrated 3rd party providers (Onfido, Experian, Equifax) for fraud and credit checks.",
        "Python 3.8 programming with Boto3.",
        "Building AWS serverless stacks (Lambda, Step Functions, API Gateway)."
      ]
    },
    {
      "name": "Lenses.io",
      "position": "Senior DevOps Engineer",
      "startDate": "2019-11-01",
      "endDate": "2020-09-01",
      "summary": "Remote contract to build a SaaS cloud solution with Kubernetes, GoLang and Python.",
      "highlights": [
        "Built a SaaS cloud solution across AWS, GCP, and Azure using Kubernetes and Go.",
        "Designed SaaS AWS Factory and multi-tier SaaS solutions.",
        "Kubernetes orchestration (EKS, GKE) and Helm charts.",
        "Go programming for Lambda and API services."
      ]
    },
    {
      "name": "GFK Nurago",
      "position": "Team Lead",
      "startDate": "2017-07-01",
      "endDate": "2019-10-01",
      "summary": "Contract to support and migrate a Global suite of panellist data aggregation tracking tools to AWS.",
      "highlights": [
        "Led the migration of global panellist data tracking tools to AWS.",
        "Implemented Big Data pipelines using AirFlow, Kinesis, Firehose, and EMR.",
        "Infrastructure orchestration with Terraform and CloudFormation.",
        "Monitoring and operations using Grafana, Prometheus, and New Relic."
      ]
    },
    {
      "name": "OpenSignal",
      "position": "Senior DevOps Engineer",
      "startDate": "2017-01-01",
      "endDate": "2017-06-01",
      "summary": "Contract to manage Web applications and Big Data technologies for mobile insight.",
      "highlights": [
        "Managed Spark/Mesos-based Big Data infrastructure.",
        "Automated build and deployment for Django-based web applications.",
        "AWS Architecture with CloudFormation, ECS, and RDS."
      ]
    },
    {
      "name": "De Persgroep Employment Services",
      "position": "Senior DevOps Engineer",
      "startDate": "2016-05-01",
      "endDate": "2016-11-01",
      "summary": "Contract to migrate an application from a private Cloud to Amazon Web Services.",
      "highlights": [
        "Migrated applications from private cloud to AWS.",
        "Conducted performance load testing and multi-account VPC architecture design.",
        "Docker, Ansible, Terraform, and ELK stack implementation."
      ]
    },
    {
      "name": "Ministry of Justice",
      "position": "Senior DevOps Engineer",
      "startDate": "2015-07-01",
      "endDate": "2015-12-01",
      "summary": "Contract to help develop the Cloud services supporting a web application for the Office of the Public Guardian.",
      "highlights": [
        "Developed cloud services for the Office of the Public Guardian.",
        "Automated AWS with CloudFormation and Terraform.",